{
  "ts": 1761264358,
  "version": "v0.4.0-beta",
  "channel": "beta",
  "decision": "pass",
  "gates": {
    "contract": "pass",
    "consistency": "pass",
    "redlines": "pass"
  },
  "reasons": [
    "contract:ok ['OK=75 BAD=0']",
    "consistency:score=88",
    "redlines:citation_pass_total=1, last_forbidden_ok=True"
  ],
  "metrics": {
    "consistency_score_overall": 88.0,
    "rag_citation_pass_total": 1
  },
  "artifacts": {
    "registry_index": "evidence/schema_registry/LATEST_INDEX.json",
    "consistency_json": "dashboards/consistency.json",
    "metrics_json": "dashboards/metrics.json"
  }
}